{
  "$schema": "https://json-schema.org/draft/2020-12/schema",
  "$id": "https://open-rta.org/genesis/schemas/trace-event.schema.json",
  "title": "TraceEvent",
  "type": "object",
  "additionalProperties": false,
  "required": ["event_id", "objective_id", "actor", "event_type", "timestamp", "status", "summary"],
  "properties": {
    "event_id": { "type": "string", "minLength": 1 },
    "objective_id": { "type": "string", "minLength": 1 },
    "action_id": { "type": "string", "minLength": 1 },
    "actor": { "type": "string", "minLength": 1 },
    "event_type": { "type": "string", "minLength": 1 },
    "timestamp": { "type": "string", "format": "date-time" },
    "status": { "type": "string", "minLength": 1 },
    "summary": { "type": "string", "minLength": 1 }
  }
}
